instructions,response
"I have an issue with my AMX touch panel, it's not responding.",Can you please provide more details about the issue? It would be helpful if you can share the model number and a description of what happens when you try to use the touch panel.
How do I reset my AMX system?,You can reset your AMX system by locating the reset button on the back of the main unit. Press and hold this button for about 10 seconds until the system reboots. Please ensure that you have backed up your data before doing this as it will erase all your settings.
"I'm getting an error message on my AMX device, what does it mean?",Could you please provide the exact error message you're seeing? It will help me identify the potential issue and guide you to the proper solution.
My AMX device isn't connecting to the network.,"Try checking the network settings on your device and ensure it's connected to the correct network. If that doesn't work, try resetting your network settings."
The audio on my AMX system isn't working properly.,"You can try adjusting the audio settings on your device. If the problem persists, it could be an issue with the audio hardware or a software glitch."
Can you help me troubleshoot my AMX system?,"I'd be happy to help you troubleshoot your AMX system. To start with, could you provide me with the model number and a description of the issue you're facing?"
My AMX device is stuck on the loading screen.,"You can try a hard reset by unplugging the device from the power source, wait for about 30 seconds and then plug it back in. This usually helps to resolve problems with loading."
The video output on my AMX system is blurry.,"This may be due to a low signal strength or an issue with your cable connection. Try checking your cables for any signs of damage, and ensure they're securely connected."
I'm unable to control my devices with the AMX system.,"Ensure that all your devices are connected properly and are on the same network. If the problem persists, there may be an issue with the configuration of your control system."
How do I update the software on my AMX device?,"To update the software on your AMX device, go to the settings menu, select 'System updates', and then 'Check for updates'. If an update is available, follow the onscreen instructions to install it."
